{
  "schema_version": "0.1.0",
  "format": "governance-evidence-attestation-json-v0.1",
  "issuer": "governance-demo-collector",
  "key_id": "demo-ed25519-2026-01",
  "signed_at": "2026-07-17T10:00:00Z",
  "statement": {
    "artifact_name": "vulnerability-scan-evidence",
    "commit_id": "abc123def456",
    "repository_id": "joku-dev/governance-framework-demo-consumer",
    "run_attempt": 1,
    "run_id": "29415015878",
    "subject": {
      "algorithm": "sha256",
      "digest": "aaaaaaaaaaaaaaaaaaaaaaaaaaaaaaaaaaaaaaaaaaaaaaaaaaaaaaaaaaaaaaaa",
      "id": "vulnerability_scan_report"
    }
  },
  "signature": "GBSTGIblRzitH62rzTr2q6w7DbK2PI9HOs4Re2WUIQAvDL5Ozn7rdfGKT5Pt4o3e0RtESgpJEk1yr/rLMuCMCA=="
}
